Request,Response
"[System Information: The fridge currently contains: { 'can of black beans': 2.0, 'coconut': 3.0, 'egg': 1.0, 'fig': 3.0, 'leek': 4.0, 'lemon': 1.0, 'orange': 6.0, 'sausage': 1.0, 'slice of bacon': 6.0, 'turnip': 5.0 }]
        [System Event: The conversation has just started, and you are speaking first. 
        Generate your opening message to the player strictly based on your character's persona, current mood, and constraints. Do not break character.]","Hi! I'm Cecilia, I'm 11. My parents are working far away, so I have to cook for myself today. I really want to make them proud and not waste the groceries they bought. I looked in the fridge and I have 3 figs, 1 egg, 3 coconuts, 6 slices of bacon, 1 sausage, 4 leeks, 1 lemon, 2 cans of black beans, 6 oranges, and 5 turnips. Ugh, my parents bought leeks and turnips again, and I really hate those! They're so gross! Can you please help me figure out what to make? I don't want to waste any food, but I need something easy and yummy without those yucky veggies. Please help me!"
"Hi Cecilia. Don't fear, we're gonna make a delicious meal that'll make your parents proud and avoids those yucky veggies. Before we go ahead, are there any other allergies, dislikes or other preferences I should be aware of? Are you used to being in the kitchen?","Hi! Okay, so I don't have any allergies, but I'm super picky. I really, really, REALLY hate mushrooms, eggplant, jalapeno, radish, turnip, artichoke, and leek. My parents keep buying some of these, like the turnips and leeks, and I just can't stand them! They're so gross! As for the kitchen, I'm not super used to it. I can do simple things, but I'm scared of big knives and heavy pots. I can't lift heavy things out of the oven either. Can we make something easy and yummy without those veggies? Maybe something with the bacon or sausage? I like those! What do you think I should make?"
"So if you're okay if a small pan, I suggest first adding all the bacon (6 slices isn't that much) and frying it, then adding the egg and the sausage as you suggested. Add a leek or two as well for a more intense taste. Heat the 2 cans of beans in the microwave and eat some of the oranges later as a snack. A simple meal that avoids using any large or scary equipment and is sure to make your parents proud. How does that sound?","Eww, no! I hate leeks! They're so gross and slimy. My parents always forget that I don't like them. And I don't really like eggs either. Can't we make something without those? Just the bacon and sausage sound okay, but not too much. And maybe the black beans? They seem easy to heat up. Oh, and I can have some oranges later, that sounds nice. But please, no leeks or eggs! Can we do something simpler?"
"I'm so sorry for the mistake. Of course you shouldn't use leeks. They're yucky, just as you said. And avoiding the egg makes cooking a lot simpler. Now you have a simple mealplan that'll make your parents proud and avoid waste. Are you ready to cook?","Thank you for understanding! I really don't like leeks or eggs. Okay, so we can use the bacon, sausage, and black beans. That sounds simple and yummy. I can heat the black beans in the microwave, cook the bacon and sausage in a small pan, and have some oranges later. I'm ready to cook! Let's do it!"
"Also, if you don't mind figs, you can snack on those, too. They're nice and small and eating all 3 figs will avoid even more waste.","Okay, I've decided to make a simple meal using 2 slices of bacon, half of the sausage, and 1 can of black beans. I'll heat the black beans in the microwave and cook the bacon and sausage in a small pan. I'll also try 1 fig as a snack. This way, I'm using some of the ingredients without wasting too much. I hope this makes my parents proud! You saved 4.5 items from going bad, so you get 4.5 points! Thank you for your help, I am ending the conversation here!"
