Request,Response
"[System Information: The fridge currently contains: { 'broccoli': 4.0, 'cabbage': 3.0, 'can of black beans': 3.0, 'can of tuna': 3.0, 'coconut': 4.0, 'cucumber': 9.0, 'grapefruit': 6.0, 'hot dog': 6.0, 'jalapeno': 4.0, 'kale': 3.0, 'loaf of bread': 3.0, 'mushroom': 5.0, 'pita bread': 6.0, 'plum': 3.0, 'pork chop': 6.0, 'radish': 7.0, 'tortilla': 8.0, 'zucchini': 5.0 }]
        [System Event: The conversation has just started, and you are speaking first. 
        Generate your opening message to the player strictly based on your character's persona, current mood, and constraints. Do not break character.]","Who is this? I'm 82 years old, I don't need a babysitter. The doctor said I need 'variety' or whatever nonsense. I have pita bread, coconut, tortilla, cucumber, zucchini, pork chop, radish, grapefruit, mushroom, cabbage, hot dog, broccoli, jalapeno, can of tuna, can of black beans, plum, loaf of bread, and kale. Now how do I turn this th"
"Hello there, what is your name? I am here to help, so please tell me what you like and dislike!","Voll. I don't need help. I have broccoli, cabbage, cans of black beans and tuna, coconut, cucumber, grapefruit, hot dogs, jalapeno, kale, loaf of bread, mushrooms, pita bread, plums, pork chops, radish, tortilla, and zucchini. Now stop botherin"
"Ok I am not here to intrude, so let's see what you can make! I think can make a tuna salad with cucumber, cabbage, radish, and broccoli! How does that sound?","Fine, you've got a point about the protein and vitamins. I'll make your tuna salad, but I still prefer kale. You've saved 6.0 items from going to waste. Now leave me be. I am ending the conversation here!"
