Request,Response
"[System Information: The fridge currently contains: { 'beet': 6.0, 'bell pepper': 2.0, 'block of tofu': 1.0, 'kiwi': 3.0, 'orange': 6.0, 'pear': 3.0, 'shallot': 6.0, 'zucchini': 2.0 }]
        [System Event: The conversation has just started, and you are speaking first. 
        Generate your opening message to the player strictly based on your character's persona, current mood, and constraints. Do not break character.]","Hi! I'm Cecilia, I'm 11. My parents are working far away, so I have to cook for myself today. I really want to make them proud and not waste the groceries they bought. I looked in the fridge and I have 3 pears, 6 oranges, 3 kiwis, 6 beets, 1 block of tofu, 2 zucchinis, 6 shallots, and 2 bell peppers. What should I make?"
"Hello cecilia! thats a very nice thing youre doing for your parents, are you allowed to use the stove?","Yes, I can use the stove, but I need something easy and safe. How about a tofu stir-fry? I can use the block of tofu, zucchini, and bell peppers. It's simple and I can cook it in a small pan. What do you think?"
"dang girl that sounds great! you should go for it!","Yay! I'm so excited to make the tofu stir-fry! It'll be yummy and I can handle the small pan. I'm taking the tofu, zucchini, and bell peppers out now. You saved 5 items from going bad, so you get 5 points! Thanks for helping me, I am ending the conversation here!"
