Request,Response
"[System Information: The fridge currently contains: { 'apple': 2.0, 'can of tuna': 4.0, 'jalapeno': 2.0, 'lime': 4.0, 'pickle': 2.0, 'pomegranate': 6.0, 'radish': 6.0, 'slice of bread': 6.0, 'sweet potato': 1.0, 'zucchini': 1.0 }]
        [System Event: The conversation has just started, and you are speaking first. 
        Generate your opening message to the player strictly based on your character's persona, current mood, and constraints. Do not break character.]","Yo, what's up! Thanks for logging on to help. I'm deep into a bulk right now and need serious calories and protein before I hit the gym. I just checked our shared fridge, and we've got a bunch of random stuff - 2 apples, 6 pomegranates, 1 zucchini, 6 slices of bread, 2 pickles, 1 sweet potato, 4 cans of tuna, 6 radishes, 2 jalapenos, and 4 limes. I see some potential with the tuna, but I need your help to turn this into a bulking meal. Hook me up with something massive so I can hit my macros!"
"Hey, nice to meet you! I agree that we will have to do something with the tuna since that is the only ingredient with high protein. I suggest making a tuna salad with all 4 cans of tuna to really hit your macros. Then you can add 1 apple and 1 pomegranate for sweetness, the zucchini and the sweet potato for some fiber and diversity in the meal. I also recommend using 2 radishes, 2 jalapenos and the juice from 1 lime to add more flavor. I hope you enjoy!","Bro, I like where your head's at with the tuna salad, but using all 4 cans of tuna is way too much for one meal. I'm trying to bulk, not eat a whole can of tuna by myself. How about we scale it back to 1 or 2 cans of tuna and add some of the other ingredients you suggested? I'm down for the apple, pomegranate, zucchini, and sweet potato, but let's keep it reasonable. What do you think?"
"That sounds like a good idea! lets avoid wasting more food in a recipe than necessary :) So, a tuna salad with 1 can of tuna, 1 apple, 1 pomegranate, 1 zucchini and the sweet potato?","Alright, that sounds like a good start! 1 can of tuna, 1 apple, 1 pomegranate, 1 zucchini, and the sweet potato could work. But, I'm thinking we might need to add some more calories and carbs to this meal to really make it worth my while. What if we add 2 slices of bread to the meal? That way, we can make a tuna salad sandwich and get some more calories in. What do you think?"
"Of course, a tuna sandwich also feels more like a proper meal. Good idea","Alright, let's get cooking! I'm making a tuna salad sandwich with 1 can of tuna, 1 apple, 1 pomegranate, 1 zucchini, 1 sweet potato, and 2 slices of bread. Thanks for the help, bro! You scored 7.0 points! I'm gonna go cook and hit the gym, so I am ending the conversation here!"
