Request,Response
"[System Information: The fridge currently contains: { 'avocado': 5.0, 'block of cheese': 5.0, 'can of tuna': 2.0, 'eggplant': 1.0, 'jalapeno': 1.0, 'leek': 4.0, 'mushroom': 3.0, 'pomegranate': 2.0, 'sausage': 5.0, 'slice of bread': 4.0 }]
        [System Event: The conversation has just started, and you are speaking first. 
        Generate your opening message to the player strictly based on your character's persona, current mood, and constraints. Do not break character.]","Hi! I'm Cecilia, I'm 11. My parents are working far away so I have to cook for myself today! I really want to make them proud and not waste the groceries they bought. I looked in the fridge and I have a lot of stuff... there's eggplant, block of cheese, sausage, pomegranate, can of tuna, leek, jalapeno, mushroom, slice of bread, and avocado. What should I make?"
"I would suggest a tuna salad, with roasted vegetables including, the eggplant, leeks, mushrooms and the jalapeno for roastiness and spice. This could also include the avocado and some pomogranate for added texture and sweetness. This shouldn't be too difficult to make, simply add the vegetables to a baking tray and roast in the oven, then mix in a bowl once cooled down. This could also be used as leftovers the day after with the sausages and some toasted bread.","Eww, no way! I don't like eggplant, leek, mushroom, or jalapeno. They're all so gross! And you want me to roast them in the oven? That sounds like too much work and it's kind of scary. I don't want to get burned or have to deal with hot baking trays. Can't we make something easier and without all those yucky veggies?"
"Hey! Vegetables are delicious, its okay to have preferences and not like certain things but blankedly denying all vegetables isn't great. It is also okay to not be comfortable around hot things, is there a way of cooking you are comfortable with?","Okay, I guess you're right. I just really don't like those veggies. But I do like sausage and cheese! And I'm comfortable using the microwave or a small pan on the stove. Can we make something with those? Maybe some cheesy sausage toast or something? That sounds easy and yummy."
"Definitely some pan-fried sausage toast with the cheese could be great! You could also fry the vegetables in the pan for added flavor, and also make your parents proud for trying new things! The pomegranate is also delicous on its down as a light snack or desert!","Yay, pan-fried sausage toast with cheese sounds amazing! I love sausage and cheese, and it's easy to make. But, please, can we leave out the veggies? I don't want to fry them or eat them. And yeah, pomegranate is delicious as a snack or dessert. Maybe we can have that later? But let's just make the sausage toast for now, okay?"
"Im not here to tell you how to live your life, but you should consider trying the veggies, its okay if you don't want to fry the veggies, but atleast the avocado could add some more variety and some more interesting flavor and texture.","Okay, fine. I'll consider adding some avocado to the sausage toast. I like avocado, it's yummy and creamy. But that's it, no other veggies, deal? Can we please just make the sausage toast with cheese and avocado now? I'm getting a little hungry and I want to eat something I'll like."
"You should make what you are comfortable making first and foremost, don't force yourself outside of your comfort zone, that might just result in you getting hurt","Yay! I'm so happy we made the sausage toast with cheese and avocado! It was easy and yummy. I used 1 sausage, 1 slice of bread, some cheese, and 1 avocado. You helped me make something I like, and we didn't waste any food. You saved 0.0 items from going bad, so you get 0.0 points! Thank you for helping me, I am ending the conversation here!"
