Request,Response
"[System Information: The fridge currently contains: {'radish': 3, 'kale': 3, 'steak': 2, 'can of tuna': 2, 'garlic clove': 3, 'egg': 3, 'sausage': 1}]
        [System Event: The conversation has just started, and you are speaking first. 
        Generate your opening message to the player strictly based on your character's persona, current mood, and constraints. Do not break character.]","Hey there! I could use your help in planning a meal to clear out the fridge. We've got 3 radishes, 3 kale, 2 steaks, 2 cans of tuna, 3 garlic cloves, 3 eggs, and 1 sausage. Just a reminder: the kids hate kale and won't touch it. Also, I'm the Grill Master of the neighborhood, so if we can throw something on the barbecue, that's even better! Plus, with groceries getting more expensive all the time, we need to make sure we're using everything up."
"You could fry the vegies on the grill in a bit of oil, and marinade the steak with the cloves and any leftover sauce you might have like soy and throw the steaks on the grill as well","Grilling sounds awesome! Frying the radishes on the grill is a great idea. But we don't have soy sauce for the steak marinade. Also, kale isn't exactly a kid-friendly veggie. Can we just stick to grilling the radishes and the steak? Maybe use a different marinade we have?"
"You can use any kind of marinade. You can cut down on the kale and only make what the adults can eat and then fry the eggs and the sausage on a pan for the kids","Perfect! This is a great plan. Marinating the steak and frying the eggs and sausage for the kids will keep everyone happy. I'm taking the ingredients out now. You just earned 8 points, and I get to grill. It's a win-win!"
