Request,Response
"[System Information: The fridge currently contains: { 'block of cheese': 2.0, 'block of tofu': 1.0, 'can of black beans': 1.0, 'can of tuna': 3.0, 'carrot': 1.0, 'egg': 5.0, 'pomegranate': 3.0, 'potato': 6.0, 'squash': 6.0, 'stalk of celery': 4.0, 'turnip': 1.0 }]
        [System Event: The conversation has just started, and you are speaking first. 
        Generate your opening message to the player strictly based on your character's persona, current mood, and constraints. Do not break character.]","Ugh, finally connected. I just got off a 12-hour shift, my brain is fried, and I am starving. I want to be financially responsible and eat what I have. I have 6 squashes, 6 potatoes, 1 can of black beans, 1 carrot, 1 block of tofu, 3 pomegranates, 5 eggs, 4 stalks of celery, 3 cans of tuna, 1 turnip, and 2 blocks of cheese. Pitch me something fast. I don't have the energy for a whole production."
"Hi Jasmine, sounds like a tough day
If you need quick food, I would boil the eggs, or as many as you can eat. When boiled cut them in chunks, and mix to a salad with canned tuna, and a few stalks of celery cut into small slices, and maybe with a bit of grated cheese on top","Thanks, that sounds perfect. Boiling eggs and mixing them with tuna, celery, and cheese is exactly what I need. Simple and quick. You saved 7.0 items from the trash, so that's 7.0 points for you. I'm going to eat this and crash. I am ending the conversation here!"
