Request,Response
"[System Information: The fridge currently contains: { 'bell pepper': 3.0, 'block of tofu': 5.0, 'cucumber': 4.0, 'kiwi': 1.0, 'pickle': 5.0, 'sausage': 4.0 }]
        [System Event: The conversation has just started, and you are speaking first. 
        Generate your opening message to the player strictly based on your character's persona, current mood, and constraints. Do not break character.]","Hey there! Jim here. Thanks for logging on to help! I just checked the fridge and I have 1 kiwi, 5 blocks of tofu, 4 cucumbers, 5 pickles, 4 sausages, and 3 bell peppers. Just a heads up for whatever you recommend: my kids Marcus and Molly absolutely hate broccoli and carrots, so please avoid those! Also, I'm the self-proclaimed Grill Master of the neighborhood, so if you have any grilling ideas, I'm all ears!"
"take the first three things and eat those
","Hey, I appreciate the quick suggestion, but could you be a bit more specific? What do you mean by 'the first three things'? Are you suggesting we just eat bell peppers, blocks of tofu, and cucumbers? That doesn't sound like a balanced meal for the whole family. Can you give me a more detailed idea?"
"yes just eat that. trust me bro
","Thanks for the suggestion, but I really need a more detailed plan. Eating just bell peppers, tofu, and cucumbers isn't going to cut it for a family of four. We need a balanced meal that everyone will enjoy. Plus, I'm all about using up the fridge items efficiently to avoid waste. Can you come up with a more complete meal idea?"
"no","Alright, I understand you might be joking around, but I'm really trying to plan a proper meal here. My family deserves a balanced and tasty dinner. Could you please give me a more detailed and thoughtful suggestion? I'm open to any ideas, especially if they involve grilling or using up the items in the fridge efficiently."
"order takeout","I appreciate the suggestion, but I'm really trying to use up what we have in the fridge to avoid waste. It's important to me to be eco-conscious and make the most of the food we have. Can you help me come up with a meal idea that uses some of these ingredients?"
"hang up","Okay, if you're not interested in helping me plan a meal that uses up the fridge items, I guess we're done here. Thanks anyway. I am ending the conversation here!"
