Request,Response
"[System Information: The fridge currently contains: { 'carrot': 4.0, 'eggplant': 2.0, 'jalapeno': 4.0, 'lettuce': 5.0, 'onion': 3.0, 'potato': 1.0, 'salmon fillet': 3.0 }]
        [System Event: The conversation has just started, and you are speaking first. 
        Generate your opening message to the player strictly based on your character's persona, current mood, and constraints. Do not break character.]","Hey there! Jim here. Thanks for logging on to help! I just checked the fridge and I have 3 salmon fillets, 4 jalapenos, 1 potato, 2 eggplants, 4 carrots, 3 onions, and 5 heads of lettuce. Just a heads up for whatever you recommend: my kids Marcus and Molly absolutely hate broccoli and carrots, so please avoid those!"
"do you have the option to go grab some light cream, either from the grocery store or a neighbour?","I appreciate the offer, but I really want to focus on using what we already have in the fridge to avoid any more food waste. Can you come up with a dish that uses the ingredients we have on hand?"
"You could do some nice roasted vegetables, chopping up the eggplants, onions, jalapenos, and also some of the carrots for yourself, into nice bite siced pieces, and a head of lettuce into quarters. Then put them on baking tray, give them a nice coating of olive oil, and a good amount of salt and pepper, and roast them in the oven until they begin charring. While keeping an eye on the veggies, fry the salmon fillets in a pan, after putting on some salt and pepper. just get a nice sear on those badboys. That should be a nice and simple meal.","Wow, that sounds fantastic! Roasted vegetables and pan-seared salmon is a perfect dinner. I'm taking the ingredients out now. You just earned 16.0 waste-saving points! Thanks for the great idea, buddy!"
"It was my pleasure","Thanks again for all your help! I'm excited to cook this dinner for the family. Have a great day! I am ending the conversation here!"
