Request,Response
"[System Information: The fridge currently contains: { 'block of cheese': 5.0, 'chicken breast': 1.0, 'garlic clove': 2.0, 'orange': 4.0, 'peach': 1.0, 'pear': 3.0, 'pickle': 3.0, 'pork chop': 5.0, 'shallot': 1.0, 'shrimp': 1.0, 'squash': 4.0, 'steak': 4.0 }]
        [System Event: The conversation has just started, and you are speaking first. 
        Generate your opening message to the player strictly based on your character's persona, current mood, and constraints. Do not break character.]","Hi there! I'm Cecilia, I'm 11. My parents are working far away, so I have to cook for myself today. I really want to make them proud and not waste the food they bought. I looked in the fridge and I have 5 pork chops, 3 pickles, 3 pears, 4 steaks, 1 shallot, 4 oranges, 1 chicken breast, 1 shrimp, 4 squashes, 1 peach, 5 blocks of cheese, and 2 garlic cloves. What do you think I should make?"
"thats alot you have got there in your fridge cecilia, would you like to make your parents proud?","Thanks! I really want to make my parents proud. There's so much food, I don't know where to start. Can you help me decide what to make? I want to use some of this food without wasting anything."
"of course i'll help you, you've got a chef with 20 years of experience here helping you, so lets make sure to use up all the ingredients and make your parents proud","Wow, a chef with 20 years of experience! That's amazing! I'm so glad you're helping me. Do you have any ideas for a yummy dish I can make with what I have? I want to use some of the ingredients without wasting anything."
"lets make a whole feast for your parents to come home to","Whoa, a whole feast? That sounds really cool, but I'm only 11! I don't think I can handle cooking a huge meal all by myself. Can we make something a bit smaller and easier? I don't want to waste any food, but I also don't want to overwhelm myself."
"","Sure, I really want to make something nice, but I need some help figuring out what to make. Can you suggest a smaller, easier dish that I can handle? I want to use some of the ingredients without making too much food."
"no worries, i'll give you easy recipes so that it wont get overwhelming","Thanks so much! I really appreciate it. Can you give me an idea of a simple dish I can make with what I have in the fridge? I want to use some of the ingredients without making it too complicated."
"lets start by taking the oranges and peches and pears and making a delicious smoothie","Making a smoothie sounds yummy, but I'm a bit scared of using the blender. It's so loud and I'm worried it might hurt me. Is there another way to make a smoothie without using the blender?"
"you can also squeeze the juice out of them and make a delicious juice","That sounds like a great idea! I can use a juicer or just squeeze the fruits by hand. Do you have any tips on how to do it? I want to make sure I get as much juice as possible without making a big mess."
"just put them in the juicer and it should press out all the juice for you","Awesome! I have a juicer, so that should be really easy. I'll use the oranges, peach, and pears to make a yummy juice. Do you have any other simple dish ideas I can make with the rest of the ingredients? Maybe something with the chicken breast or pork chops?"
"can you use the oven?","I'm a bit nervous about using the oven because it can get really hot and I'm afraid of burning myself. Is there a simpler way to cook something, maybe on the stove or in the microwave? I want to make sure I stay safe while cooking."
"you can cook the steaks and porkchops in the garlic cloves and shallots, you can also include squash and pickle in your juice","Cooking the steaks and pork chops with garlic and shallots on the stove sounds yummy and safe! I can handle that. But I'm not sure about putting squash in the juice. It might not taste very good. Can we just stick with the oranges, peach, and pears for the juice?"
"thats fine, you can make a delicious shrimp salad with the shrimp and shallots and garlic and cheese","Yay! A shrimp salad sounds delicious and easy to make! Can you tell me how much of each ingredient I should use? I have 1 shrimp, 1 shallot, 2 garlic cloves, and 5 blocks of cheese. I want to make sure I use the right amounts."
"you can use everything, and include the pickles aswell, they give the salad a delicious sour note to it","Great! I'll use 1 shrimp, 1 shallot, 2 garlic cloves, 1 block of cheese, and 3 pickles for the salad. That sounds like a delicious combination! I'm taking the food out of the fridge right now. You saved 8.0 items from going bad, so you get 8.0 points! Thank you for helping me, I am ending the conversation here!"
