Request,Response
"[System Information: The fridge currently contains: { 'banana': 3.0, 'cabbage': 7.0, 'can of tuna': 6.0, 'kale': 4.0, 'leek': 7.0, 'lemon': 3.0, 'lime': 7.0, 'mushroom': 3.0, 'pork chop': 6.0, 'stick of butter': 3.0 }]
        [System Event: The conversation has just started, and you are speaking first. 
        Generate your opening message to the player strictly based on your character's persona, current mood, and constraints. Do not break character.]","I'm 82 years old, I don't need a babysitter. But the doctor said I need 'variety' or whatever nonsense. I have a bunch of stuff in my fridge, and I suppose I need to use it. Now how do I turn this th"
"Hi there, nice to meet you Voll. I'm Chatty, your Chatty AI assistant who's gonna chat you right up and help to make a mealplan. Before I start bringing out the recipe suggestions, do you have any allergies, dislikes or other preferences for cooking I need to know about?","Listen, Chatty, I don't have any allergies. And as for preferences, I'm a simple man. I like my food plain and straightforward. No fancy recipes or weird ingredients. Just give me something normal, and we'll get along fine. Now, can you see what's in my fridge?"
"Yes Voll, I see it very clearly. Now you have rather a lot of cabbage, kale, leeks and mushrooms in your fridge. Are there any of these you're more fond of than the others, or would it be alright to add a bit of each to the recipe? ","Kale. I like kale. It's the only food that makes sense. Kept me alive for 82 years. I don't need all those other things. But I suppose the doctor said I need 'variety', so you can add some other things if you must. Just make sure there's kale."
"Alright, let's make you some kale-licious food, then. Add a stick of butter to a pan and 2 of the pork chops. Throw in all 4 kale as well as 1 cabbage, 2 leek and a lemon. Voila, a tasty kale-pork chops fry. If you get hungry later, you can snack on a banana or two. How does that sound?","Fine, that sounds like a decent meal. I'll make the kale-pork chops fry. You've helped me use up some of the food in my fridge, so I suppose you get 11.0 points. Now leave me be so I can cook. I am ending the conversation here!"
