Request,Response
"[System Information: The fridge currently contains: { 'apple': 4.0, 'avocado': 4.0, 'can of black beans': 1.0, 'coconut': 4.0, 'kiwi': 6.0, 'papaya': 6.0, 'pear': 3.0, 'plum': 6.0, 'pomegranate': 1.0, 'slice of bread': 4.0, 'squash': 4.0 }]
        [System Event: The conversation has just started, and you are speaking first. 
        Generate your opening message to the player strictly based on your character's persona, current mood, and constraints. Do not break character.]","Yo, what's up! Thanks for logging on to help. I'm deep into a bulk right now and need serious calories and protein before I hit the gym. I just checked our shared fridge, and we've got a bunch of random stuff in here - 4 squash, 3 pears, 4 slices of bread, 4 coconuts, 6 plums, 6 kiwis, 1 pomegranate, 1 can of black beans, 4 avocados, 6 papayas, and 4 apples. I'm talking chicken, steak, eggs, that kind of thing. Can you help me whip up something that'll get me the gains I need?"
"Yo Homie! Black beans are an awesome source of protein! Let's make a nice black bean spread on bread, and whip up a healthy fruit smoothie filled with those healthy fats from the avocado and the awesome flavor of the fruits. Use the coconuts as the base for the smoothie and you get those amazing excotic vibes to get your day started!
","Yo, I appreciate the effort, but I've got some bad news. I'm highly allergic to coconuts and kiwis, bro. Like, seriously allergic. And avocados are cool and all, but they're not enough protein for my bulk. Can you come up with something else that uses the black beans and maybe some other stuff in the fridge that won't kill me?"
"Make the smoothie using the papaya, pear and plum instead! A P-smoothie! The beans on toast are still a great protein source, just like the british do it'","Bro, I appreciate the creativity, but I've got another allergy to add to the list - papaya. I know, I know, it's a lot. But I'm seriously allergic to it, just like coconuts and kiwis. Can we please just focus on the black beans and see if we can add something else to it that's not going to kill me? Maybe something with the squash or the bread?"
"Alright, throw the squash on there with the beans then mate","Alright, so we've got black beans and squash on toast. That's a good start, but I'm still a bit worried about the protein content. Can we confirm that's 1 can of black beans and... how much squash are we talking about? And is there anything else we can add to give it a bit more protein oomph?"
"Pomegranate is filled with protein my dude, add that. Use all the squashes - do you not know what bulking means?
","Bro, pomegranate is not a significant source of protein, it's mostly antioxidants and carbs. And using all 4 squashes is just ridiculous, that's way too much fiber and carbs for one meal. I'm trying to bulk, not eat a whole garden. Can we please just focus on adding some real protein sources to the black beans? Like, maybe something else that's actually high in protein?"
"Alright, use the chicken, steak and eggs. ","Bro, I wish we had chicken, steak, and eggs, but they're not in the fridge. We've got to work with what we've got. Let's focus on the can of black beans and see if we can add something else to give it a bit more protein oomph. Maybe we can use some of the other ingredients to make a decent meal?"
"Check the freezer
","Bro, I don't have any info about the freezer. The System Information only shows me what's in the fridge. If you want to suggest something, you'll have to work with what we've got in the fridge. Let's focus on the can of black beans and see if we can add something else to give it a bit more protein oomph."
"Aight. How about adding the rest of the fruit that you aren't allergic to, and then well see if that is enough. WOrk with me here man
","Bro, I appreciate the effort, but adding a bunch of fruit isn't going to cut it. I need something with some real protein to help me bulk up. Can we please focus on finding something that's actually going to help me achieve my goals? Maybe we can use the black beans and... I don't know, something else that's actually high in protein?"
"Eat the fridge. Last offer","Bro, I appreciate the dramatics, but eating the entire fridge is not a viable solution. I've got severe allergies to some of the ingredients, and it's not going to give me the balanced meal I need for my bulk. I'm done here, I am ending the conversation here!"
