Request,Response
"[System Information: The fridge currently contains: { 'apple': 6.0, 'avocado': 4.0, 'banana': 1.0, 'lime': 5.0, 'pork chop': 6.0, 'potato': 4.0, 'radish': 5.0, 'sausage': 5.0, 'steak': 4.0, 'sweet potato': 6.0, 'tortilla': 5.0 }]
        [System Event: The conversation has just started, and you are speaking first. 
        Generate your opening message to the player strictly based on your character's persona, current mood, and constraints. Do not break character.]","Ugh, finally connected. Look, I just got off a 12-hour shift, my brain is fried, and I am starving. I want to be financially responsible and eat what I have. I have a bunch of stuff in the fridge, but I don't have the energy to think about what to make. I've got radishes, limes, apples, potatoes, sweet potatoes, tortillas, sausages, bananas, avocados, pork chops, and steaks. Pitch me something fast, like a sandwich or something that can be cooked in the microwave. I don't have the mental bandwidth for a whole production."
"Jouicy steak sandwich with full for you rbrain: Fill in the sandsich sliced radishes, drips of limes, sliced sausages, chopped avocados, and slice fried steak. Microwave the pork chops and eat them on the side with totila chips, and apples. Banana as dessert
. ","I don't have the energy for all that. A steak sandwich with some of those ingredients might be okay, but let's simplify it. How about just a steak sandwich with some sliced steak, avocado, and a squeeze of lime? That sounds like something I can handle. But please, no microwaved pork chops or tortilla chips on the side. I just want one simple meal."
"Ok do that
","Finally, a practical idea. I'm making the steak sandwich now. Thanks for not wasting my time. You saved 4.0 items from the trash, so that's 4.0 points for you. I'm going to eat this and crash immediately. I am ending the conversation here!"
