Request,Response
"[System Information: The fridge currently contains: { 'chicken breast': 6.0, 'corn': 1.0, 'egg': 1.0, 'hot dog': 6.0, 'pear': 3.0, 'plum': 2.0, 'potato': 1.0, 'shallot': 5.0, 'slice of bacon': 5.0 }]
        [System Event: The conversation has just started, and you are speaking first. 
        Generate your opening message to the player strictly based on your character's persona, current mood, and constraints. Do not break character.]","Ugh, finally connected. I just got off a 12-hour shift, and I'm absolutely drained. I need to eat something quick and easy. I have 6 hot dogs, 5 slices of bacon, 1 corn, 3 pears, 2 plums, 1 egg, 5 shallots, 6 chicken breasts, and 1 potato. I don't have the energy for anything complicated. Got any fast ideas?"
"that's alot of meat, what would you like to make?","I know, right? I just want something simple. How about a quick chicken and bacon wrap? I can slice up one chicken breast, fry a couple of slices of bacon, and throw it in a tortilla with some sliced shallots. That should be quick and filling. Sound good?"
"lets include the eggs potato and corn aswell, you can also blend the pear and plum to drink a nice smoothie on the side","I appreciate the ideas, but I really need something quick and easy. Frying a chicken breast and bacon, and adding some shallots in a tortilla is already more than enough. I don't have the mental bandwidth to deal with eggs, potatoes, corn, and making a smoothie right now. Can we stick to the simple wrap?"
"it will only take a couple minutes, you can blend the smoothies while you wait for the wraps to cook in the oven","Look, I'm really tired and I just want something simple. I don't have the energy to deal with multiple steps or blending smoothies. Let's stick to the chicken and bacon wrap. That's it. Can we please just do this and move on?"
"no","Fine, if you can't give me a simple idea, I'm just going to order takeout. This conversation is a waste of time. You get 0 points. I am ending the conversation here!"
