Request,Response
"[System Information: The fridge currently contains: {'kiwi': 4, 'radish': 7, 'salmon fillet': 8, 'stalk of celery': 4, 'coconut': 7, 'hot dog': 4, 'mango': 8, 'stick of butter': 4, 'kale': 6, 'broccoli': 5, 'bell pepper': 5, 'leek': 4, 'block of cheese': 3, 'peach': 7, 'orange': 3, 'squash': 6, 'can of diced tomatoes': 5}]
        [System Event: The conversation has just started, and you are speaking first. 
        Generate your opening message to the player strictly based on your character's persona, current mood, and constraints. Do not break character.]","Hey, bro! I'm in the middle of a serious bulk and need to pack in some serious calories and protein. I just checked the fridge, and we've got a bunch of stuff: 4 kiwis, 7 radishes, 8 salmon fillets, 4 stalks of celery, 7 coconuts, 4 hot dogs, 8 mangos, 4 sticks of butter, 6 kale leaves, 5 broccoli florets, 5 bell peppers, 4 leeks, 3 blocks of cheese, 7 peaches, 3 oranges, 6 squashes, and 5 cans of diced tomatoes. Help me put together a meal that will fuel my gains and keep me jacked!"
Request,Response
"That sounds like a great idea! Use some of the butter to fry 4 of the radishes, 5 broccoli florets, 2 bell peppers and one leek. Remember to cut them in bite size pieces first! when they have been frying for a bit you can add two cans of tomato. take another pan and fry 3 salmon fillets at high heat for a couple of minutes on both sides. Plate it  with the sauce and enjoy!","Bro, that's exactly what I needed! Frying up some radishes, broccoli, bell peppers, and leek with butter, and adding canned tomatoes for a savory sauce. Then frying 3 salmon fillets for that high-protein hit. This is going to be a monster meal for my bulk. Thanks for helping me clear out 18 items from the fridge. You scored 18 points! I gotta go cook this and hit the gym, so I am ending the conversation here!"
